"label","author","author_s_id","title","year","source_title","volume","issue","art_no","page_start","page_end","page_count","cited_by","doi","link","affiliations","author_with_affiliations","abstract","author_keywords","index_keywords","document_type","publication_stage","open_access","source","eid","screened_abstracts_i","notes_i","screened_abstracts","notes"
"ref_006","Feng S. and Lu H. and Yao T. and Liu Y. and Tian P. and Lu J.","57211081305;25937323000;57221291580;57207958011;57194322893;57199239134;","Microplastic footprints in the Qinghai-Tibet Plateau and their implications to the Yangtze River Basin",2021,"Journal of Hazardous Materials","407",NA,"124776",NA,NA,NA,NA,"10.1016/j.jhazmat.2020.124776","https://www.scopus.com/inward/record.uri?eid=2-s2.0-85098692316&doi=10.1016%2fj.jhazmat.2020.124776&partnerID=40&md5=3e88717197fe5189c52de71338e043b5","Key Laboratory of Water Cycle and Related Land Surface Process, Institute of Geographic Science and Natural Resources Research, Chinese Academy of Science, Beijing, 100101, China; School of Renewable Energy, North China Electric Power University, Beijing, 102206, China","Feng, S., Key Laboratory of Water Cycle and Related Land Surface Process, Institute of Geographic Science and Natural Resources Research, Chinese Academy of Science, Beijing, 100101, China, School of Renewable Energy, North China Electric Power University, Beijing, 102206, China; Lu, H., Key Laboratory of Water Cycle and Related Land Surface Process, Institute of Geographic Science and Natural Resources Research, Chinese Academy of Science, Beijing, 100101, China; Yao, T., Key Laboratory of Water Cycle and Related Land Surface Process, Institute of Geographic Science and Natural Resources Research, Chinese Academy of Science, Beijing, 100101, China; Liu, Y., School of Renewable Energy, North China Electric Power University, Beijing, 102206, China; Tian, P., Key Laboratory of Water Cycle and Related Land Surface Process, Institute of Geographic Science and Natural Resources Research, Chinese Academy of Science, Beijing, 100101, China, School of Renewable Energy, North China Electric Power University, Beijing, 102206, China; Lu, J., School of Renewable Energy, North China Electric Power University, Beijing, 102206, China","Microplastics (MPs) are pervasive in the environment and have posed growing threat to ecosystems and human health. This study investigated MP abundances in surface water (fresh and salt lakes, urban and rural rivers, etc.) from 28 stations in the Qinghai-Tibet Plateau. MPs were detected in 25 out of 28 water samples with relatively low abundance (average 584.82 particles m−3). Fibers were the most frequently observed shape, particle sizes mostly ranged from 100 to 500 µm, and the greatest number of MPs was polypropylene. Source analysis identified the major sources of domestic wastewater and tourism in some areas. The concentration and proportion of small MPs (20–100 µm) in salty water were apparently greater than that in fresh water, indicating Salt intrusion accelerated MPs fragmentation. As the study area is the origin of the Yangtze River, we further compared the MP distribution throughout the watershed. Nearly two orders of magnitude in MP concentrations were increased associated with urban agglomeration in the middle and downstream areas, but the highest level was marked around the Yichang City (location of the Three Gorges Reservoir) due to interception associated with sedimentation and precipitation. This study provides data and theoretical bases for analyzing MPs migration and degradation processes in high altitudes. © 2020 Elsevier B.V.","Footprint; Microplastics; Remote area; Tibetan Plateau; Yangtze River","Health risks; Microplastic; Particle size analysis; Polypropylenes; Reservoirs (water); Salt water intrusion; Tourism; Degradation process; Domestic wastewater; Downstream areas; Orders of magnitude; Qinghai Tibet plateau; Three gorges reservoir; Urban agglomerations; Yangtze River basin; Rivers; concentration (composition); detection method; ecological footprint; plastic waste; sedimentation; surface water; watershed; China; Hubei; Qinghai-Xizang Plateau; Three Gorges Reservoir; Yangtze Basin; Yichang","Article","Final",NA,"Scopus","2-s2.0-85098692316","selected","Micro plastics literature?","excluded","Microplastics"
"ref_010","Wohlgemuth R. and Twardowski T. and Aguilar A.","6602073766;7004250246;7102046774;","Bioeconomy moving forward step by step – A global journey",2021,"New Biotechnology","61",NA,NA,22,28,NA,NA,"10.1016/j.nbt.2020.11.006","https://www.scopus.com/inward/record.uri?eid=2-s2.0-85096653392&doi=10.1016%2fj.nbt.2020.11.006&partnerID=40&md5=66876e8f4f40027b59e7c3282db59d5b","Institute of Molecular and Industrial Biotechnology, Lodz University of Technology, Stefanowskiego Street 4/10, Lodz, 90-924, Poland; Swiss Coordination Committee for Biotechnology, Nordstrasse 15, Zürich, 8021, Switzerland; Institute of Bioorganic Chemistry, Polish Academy of Sciences, Poznan, Poland; Task Group Bioeconomy, European Federation of Biotechnology, Barcelona, Spain; Working Group Bioeconomy, ESAB, European Society of Applied Biocatalysis, Frankfurt Am Main, Germany","Wohlgemuth, R., Institute of Molecular and Industrial Biotechnology, Lodz University of Technology, Stefanowskiego Street 4/10, Lodz, 90-924, Poland, Swiss Coordination Committee for Biotechnology, Nordstrasse 15, Zürich, 8021, Switzerland; Twardowski, T., Institute of Bioorganic Chemistry, Polish Academy of Sciences, Poznan, Poland, Task Group Bioeconomy, European Federation of Biotechnology, Barcelona, Spain; Aguilar, A., Task Group Bioeconomy, European Federation of Biotechnology, Barcelona, Spain, Working Group Bioeconomy, ESAB, European Society of Applied Biocatalysis, Frankfurt Am Main, Germany","Continuous, inspiring and interconnected step-by-step changes in thought and understanding, knowhow, actions and behaviour have often been instrumental in transitions from one particular age to the next in human history. This also applies to the present century and its sustainability challenges at the planetary, regional and local levels. Therefore, it is of great importance and relevance to move forward on the journey which has been started globally to address the not insignificant number of challenges. It is however essential to go beyond descriptive work by continuing with novel, inspiring and interconnected steps to find solutions to overcome these challenges. As this huge task also requires multidimensional communication, understanding and actions across different regions, cultures, disciplines and knowledge areas, the development of a common conceptual framework such as the concept of bioeconomy has been accepted globally as very valuable. The momentum which has been created in more than 50 countries around the world by the growing number of activities, initiatives and strategies in bioeconomy is very encouraging. This offers great opportunities to mobilize even more stakeholders in science and industry, as well as society, to join the bioeconomy journey. Strategic high-level concepts such as preserving the value of the natural capital of planet earth, connecting economy and ecology, sustaining the boundary conditions and habitability of our biosphere are highly important. It is also essential on the bioeconomy journey to connect with highly specific and actionable missions, programs and plans towards sustainable economic growth under the boundary conditions of our planet. © 2020","Bioeconomy; Ecology; Habitability; Natural capital; Planetary boundary conditions; Sustainability; Sustainable economic growth","Boundary conditions; Earth (planet); Economics; Technology transfer; Conceptual frameworks; Knowledge areas; Natural capital; Planet earth; Step changes; Sustainable economic growth; Bioeconomy; article; astronomy; biosphere; conceptual framework; ecology; human; sustainable growth","Article","Final",NA,"Scopus","2-s2.0-85096653392","selected","Bioeconomy literature","excluded","Bioeconomy"
"ref_012","Fidélis T. and Cardoso A.S. and Riazi F. and Miranda A.C. and Abrantes J. and Teles F. and Roebeling P.C.","14061741200;57221336111;57208527668;57221332955;55674930500;55445741900;55984154700;","Policy narratives of circular economy in the EU – Assessing the embeddedness of water and land in national action plans",2021,"Journal of Cleaner Production","288",NA,"125685",NA,NA,NA,NA,"10.1016/j.jclepro.2020.125685","https://www.scopus.com/inward/record.uri?eid=2-s2.0-85098888327&doi=10.1016%2fj.jclepro.2020.125685&partnerID=40&md5=d17f7de0421eba8ff311f854628f27d2","GOVCOPP and Department of Environment and Planning, University of Aveiro, Aveiro, 3800-193, Portugal; Department of Environment and Planning, University of Aveiro, Aveiro, 3810-193, Portugal; Rectory, GOVCOPP and Department of Social, Political and Territorial Sciences, University of Aveiro, Aveiro, 3810-193, Portugal; CESAM and Department of Environment & Planning, University of Aveiro, Aveiro, 3810-193, Portugal; Wageningen Economic Research, Wageningen University and Research, Wageningen, 6706 KN, Netherlands","Fidélis, T., GOVCOPP and Department of Environment and Planning, University of Aveiro, Aveiro, 3800-193, Portugal; Cardoso, A.S., GOVCOPP and Department of Environment and Planning, University of Aveiro, Aveiro, 3800-193, Portugal; Riazi, F., Department of Environment and Planning, University of Aveiro, Aveiro, 3810-193, Portugal; Miranda, A.C., Department of Environment and Planning, University of Aveiro, Aveiro, 3810-193, Portugal; Abrantes, J., Department of Environment and Planning, University of Aveiro, Aveiro, 3810-193, Portugal; Teles, F., Rectory, GOVCOPP and Department of Social, Political and Territorial Sciences, University of Aveiro, Aveiro, 3810-193, Portugal; Roebeling, P.C., CESAM and Department of Environment & Planning, University of Aveiro, Aveiro, 3810-193, Portugal, Wageningen Economic Research, Wageningen University and Research, Wageningen, 6706 KN, Netherlands","Following the challenges of the European Union (EU), member states have adopted circular economy (CE) plans and strategies, with objectives and measures to foster circularity. Although the concept of CE refers to various natural resources such as water and land, little is known on how current CE policies are integrating these environmental resources. This article assesses how water and land concerns are embedded in the EU CE action plans issued in 2015 and 2020 and a set of nine member states’ subsequent national plans. The assessment used a content analysis based on two variables, the frequency of water and land’ related terms and the consistency of their inclusion within the plans. The findings reveal that neither water nor land emerge as major concerns in the CE plans, in comparison to materials or waste. Also, they are not consistently associated with the typical components of the plans namely problem-showcase, objectives, strategies and measures, stakeholders, and CE performance indicators. Nevertheless, the embeddedness of water is more evident in the plans of southern countries, whereas land concerns are much more erratic. If water and land concerns, are to be at the forefront of the transition to circularity, as the literature recommends, and if these plans are expected to offer an integrated approach of the CE concept, further efforts should be made to ensure their embeddedness. © 2020","Action plans; Circular economy; Land; Water","Industrial engineering; Production engineering; Circular economy; Content analysis; Embeddedness; Environmental resources; European union; Integrated approach; Performance indicators; Strategies and measures; Economic and social effects","Article","Final",NA,"Scopus","2-s2.0-85098888327","selected","Narratives in the circular economy","excluded","Circular economy"
"ref_014","Gerassimidou S. and Martin O.V. and Chapman S.P. and Hahladakis J.N. and Iacovidou E.","55806148700;8714630200;57213795428;8633412400;35573460300;","Development of an integrated sustainability matrix to depict challenges and trade-offs of introducing bio-based plastics in the food packaging value chain",2021,"Journal of Cleaner Production","286",NA,"125378",NA,NA,NA,NA,"10.1016/j.jclepro.2020.125378","https://www.scopus.com/inward/record.uri?eid=2-s2.0-85098064421&doi=10.1016%2fj.jclepro.2020.125378&partnerID=40&md5=814b6689b53d278fc7e4d8fd0eb41f7a","School of Civil Engineering, University of Leeds, Woodhouse LaneLS2 9TJ, United Kingdom; Sustainable Plastics Research Group (SPlaSH), Brunel University London, UxbridgeUB8 3PH, United Kingdom; Institut de Mathématiques Marseille, Aix Marseille Université, CNRS, France; Institute of Biological, Environmental, and Rural Sciences, Gogerddan, AberystwythSY23 3EE, United Kingdom; Center for Sustainable Development, College of Arts and Sciences, Qatar University, P.O. Box: 2713, Doha, Qatar","Gerassimidou, S., School of Civil Engineering, University of Leeds, Woodhouse LaneLS2 9TJ, United Kingdom; Martin, O.V., Sustainable Plastics Research Group (SPlaSH), Brunel University London, UxbridgeUB8 3PH, United Kingdom; Chapman, S.P., Institut de Mathématiques Marseille, Aix Marseille Université, CNRS, France, Institute of Biological, Environmental, and Rural Sciences, Gogerddan, AberystwythSY23 3EE, United Kingdom; Hahladakis, J.N., Center for Sustainable Development, College of Arts and Sciences, Qatar University, P.O. Box: 2713, Doha, Qatar; Iacovidou, E., Sustainable Plastics Research Group (SPlaSH), Brunel University London, UxbridgeUB8 3PH, United Kingdom","As global plastic pollution is gaining increased attention, the use of bio-based plastics, especially in the food packaging sector, is growing in popularity. While this move is regarded as a solution to plastic pollution, it may shift or create detrimental impacts elsewhere in the production, consumption, management system, a possibility that is underexplored. The aim of the present study is to identify the potential challenges and trade-offs associated with the introduction of bio-based plastics in the food packaging industry, and highlight issues relevant to policy and decision-making processes. We employ a whole system approach to review the literature and assess holistically the performance of bio-based plastics, which looks at the entire lifecycle of bio-based plastic packaging (i.e. production, consumption, management) and considers wider aspects in the environmental, economic, social and technical sustainability domains. Based on our findings, we developed, and present herein, a sustainability decision matrix, a novel guiding tool, which can provide important insights into the potential impacts of the introduction of larger amount of bio-based plastic food packaging in the future and support decision-making processes. In conclusion, our preliminary high-level assessment of the bio-based plastics production, use and management system clearly reveals a number of blind-spots across the entire system that are currently ignored by the use of single-dimensional approaches. This highlights that the sustainability assessment of specific bio-based polymers requires thorough and further research that takes into account the type of feedstock, infrastructure availability, and interactions between sustainability domains, to ensure that the substitution of petrochemical-based plastics with bio-based alternatives in food packaging sector will not lead to unintended consequences. © 2020","Bioplastics; Holistic view; Life cycle; Plastic waste management; Plastics; Sustainability","Chemical contamination; Commerce; Decision making; Economic and social effects; Elastomers; Life cycle; Packaging; Packaging machines; Plastic products; Pollution; Sustainable development; Bio-based polymers; Decision making process; Food packaging industry; Management systems; Plastic pollutions; Plastics production; Sustainability assessment; Unintended consequences; Plastics industry","Review","Final",NA,"Scopus","2-s2.0-85098064421","selected","bioplastics","excluded","Bioplastics"
"ref_015","Petersen F. and Hubbart J.A.","57193250908;16202800900;","The occurrence and transport of microplastics: The state of the science",2021,"Science of the Total Environment","758",NA,"143936",NA,NA,NA,NA,"10.1016/j.scitotenv.2020.143936","https://www.scopus.com/inward/record.uri?eid=2-s2.0-85097708107&doi=10.1016%2fj.scitotenv.2020.143936&partnerID=40&md5=f0f984add3e7c6a13e4e0b9e18679602","Institute of Water Security and Science, West Virginia University, 1194 Evansdale Drive, 3109 Agricultural Sciences Building, Morgantown, WV  26506, United States; Schools of Agriculture and Food, and Natural Resources, Davis College of Agriculture, Natural Resources and Design, West Virginia University, 3109 Agricultural Sciences Building, Morgantown, WV  26506, United States","Petersen, F., Institute of Water Security and Science, West Virginia University, 1194 Evansdale Drive, 3109 Agricultural Sciences Building, Morgantown, WV  26506, United States; Hubbart, J.A., Institute of Water Security and Science, West Virginia University, 1194 Evansdale Drive, 3109 Agricultural Sciences Building, Morgantown, WV  26506, United States, Schools of Agriculture and Food, and Natural Resources, Davis College of Agriculture, Natural Resources and Design, West Virginia University, 3109 Agricultural Sciences Building, Morgantown, WV  26506, United States","Microplastic (MP) particles have been observed in most environments and concentrations are expected to increase over the coming decades given continued and increased production of synthetic polymer products. The expected increase in plastic pollution (including MPs) may elevate the risk posed by these synthetic particles to both environmental and human health. The purpose of this review is to provide a review of the state of knowledge regarding the occurrence and transport of MPs in and across three of the Earths subsystems, specifically, the lithosphere, atmosphere, and hydrosphere. Evidence is presented that shows the lithosphere includes substantial MP accumulation (e.g. approximately 25 particles L−1 in landfill leachate), the impacts of which remain poorly understood. The atmosphere plays an important role in MP transport, with increased occurrence and higher transport concentrations noted in more densely populated areas (e.g. 175 to 313 particles m−2 d−1 in Dongguan China). In the hydrosphere, freshwater ecosystems alternate between MP transport (e.g. rivers) and deposition (e.g. lakes) with flow rate being identified as a key factor determining the movement and fate of MPs. Conversely, marine ecosystems act as a major sink for MP pollution (e.g. MP comprise 94%, approximately 1.69 trillion pieces, of plastic pieces in the Great Pacific Garbage Patch), driven by direct deposition or by transport via the atmosphere or freshwater conveyance systems (e.g. streams, rivers, or ice sheets). Once ingested by organisms, the trophic transfer and bioaccumulation of MPs has been confirmed with the polymer particles potentially accumulating in or impacting fauna, flora, microbes, and humans. Finally, 16 areas are identified in which future MP research efforts should be focused, with the goal of accurately identifying the scope and potential risks posed by synthetic polymer pollution. This review serves as a valuable steppingstone for future research and researchers wishing to address MP research gaps across various environmental settings in the coming decades. © 2020 Elsevier B.V.","Atmosphere; Biosphere; Environmental subsystems; Hydrosphere; Lithosphere; Micro-plastics; Plastic pollution; Pollutant transport; Research needs","Biochemistry; Deposition; Ecosystems; Health risks; Hydrosphere; Lake pollution; Leachate treatment; Marine pollution; Microplastic; Polymers; Water; Conveyance systems; Direct deposition; Freshwater ecosystem; Landfill leachates; Plastic pollutions; Polymer particles; Research efforts; Synthetic polymers; River pollution; cellulose acetate; microplastic; polyamide; polyethylene; polyethylene terephthalate; polypropylene; polystyrene; polyvinylchloride; atmospheric pollution; concentration (composition); hydrosphere; lithosphere; plastic waste; pollutant transport; source apportionment; water pollution; atmosphere; atmospheric transport; bioaccumulation; China; concentration (parameter); environmental factor; environmental impact; fauna; flora; flow rate; freshwater environment; human; hydrosphere; knowledge; landfill leachate; lithosphere; marine environment; microorganism; microplastic pollution; nonhuman; priority journal; Review; China; Dongguan; Guangdong","Review","Final",NA,"Scopus","2-s2.0-85097708107","selected",NA,"excluded","Microplastics"
"ref_017","Qian J. and Tang S. and Wang P. and Lu B. and Li K. and Jin W. and He X.","8722548700;57216979541;8863734200;57193927287;57192183871;57208206987;57208205523;","From source to sink: Review and prospects of microplastics in wetland ecosystems",2021,"Science of the Total Environment","758",NA,"143633",NA,NA,NA,NA,"10.1016/j.scitotenv.2020.143633","https://www.scopus.com/inward/record.uri?eid=2-s2.0-85096622164&doi=10.1016%2fj.scitotenv.2020.143633&partnerID=40&md5=fffeb64c26239f4499498bab7a8e5486","Key Laboratory of Integrated Regulation and Resource Development on Shallow Lakes, Ministry of Education, Hohai University, Nanjing, 210098, China; College of Environment, Hohai University, Nanjing, 210098, China","Qian, J., Key Laboratory of Integrated Regulation and Resource Development on Shallow Lakes, Ministry of Education, Hohai University, Nanjing, 210098, China, College of Environment, Hohai University, Nanjing, 210098, China; Tang, S., Key Laboratory of Integrated Regulation and Resource Development on Shallow Lakes, Ministry of Education, Hohai University, Nanjing, 210098, China, College of Environment, Hohai University, Nanjing, 210098, China; Wang, P., Key Laboratory of Integrated Regulation and Resource Development on Shallow Lakes, Ministry of Education, Hohai University, Nanjing, 210098, China, College of Environment, Hohai University, Nanjing, 210098, China; Lu, B., Key Laboratory of Integrated Regulation and Resource Development on Shallow Lakes, Ministry of Education, Hohai University, Nanjing, 210098, China, College of Environment, Hohai University, Nanjing, 210098, China; Li, K., Key Laboratory of Integrated Regulation and Resource Development on Shallow Lakes, Ministry of Education, Hohai University, Nanjing, 210098, China, College of Environment, Hohai University, Nanjing, 210098, China; Jin, W., Key Laboratory of Integrated Regulation and Resource Development on Shallow Lakes, Ministry of Education, Hohai University, Nanjing, 210098, China, College of Environment, Hohai University, Nanjing, 210098, China; He, X., Key Laboratory of Integrated Regulation and Resource Development on Shallow Lakes, Ministry of Education, Hohai University, Nanjing, 210098, China, College of Environment, Hohai University, Nanjing, 210098, China","The source, distribution, migration, and fate of microplastics (MPs) in aquatic and terrestrial ecosystems have received much attention. However, the relevant reports in wetland ecosystems, the boundary area between water and land, are still rare. Where are the sources and sinks of MPs in the wetland? The latest researches have shown that the sources of MPs in wetlands include sewage discharge, surface runoff, and plastic wastes from aquaculture. Fibers and fragments are the most common shapes, and PE, PP, PS can be detected in water or sediment matrices, and biota of wetlands. The distribution is affected by hydrodynamic conditions, sediment properties, and vegetation coverage. Factors affecting the vertical migration of MPs include their own physical and chemical properties, the combination of substances that accelerate deposition (mineral adsorption and biological flocculation), and resuspension. Minerals tend to adsorb negatively charged MPs while algae aggregates have a preference for positively charged MPs. The wetlands vegetation can trap MPs and affect their migration. In water matrices, MPs are ingested by organisms and integrated into sediments, which makes them seem undetectable in the wetland ecosystem. Photodegradation and microbial degradation can further reduce the MPs in size. Although recent research has increased, we are still searching for a methodological harmonization of the detection practices and exploring the migration rules and fate patterns of MPs. Our work is the first comprehensive review of the source, distribution, migration, and fate of MPs in wetland ecosystems. It reveals the uniqueness of wetland habitat in the research of MPs and indicates the potential of wetlands acting as sources or sinks for MPs. © 2020 Elsevier B.V.","Distribution; Fate; Microplastics; Migration; Source; Wetland ecosystems","Aquatic ecosystems; Biodegradation; Microplastic; Photodegradation; Sediments; Sewage; Vegetation; Biological flocculations; Hydrodynamic conditions; Microbial degradation; Physical and chemical properties; Positively charged; Sediment properties; Terrestrial ecosystems; Vegetation coverage; Wetlands; aquatic ecosystem; biodegradation; environmental fate; hydrodynamics; photodegradation; plastic waste; pollutant source; pollutant transport; source-sink dynamics; terrestrial ecosystem; wetland","Review","Final",NA,"Scopus","2-s2.0-85096622164","selected","NAMicroplastics","excluded",NA
