"label","author","author_s_id","title","year","source_title","volume","issue","art_no","page_start","page_end","page_count","cited_by","doi","link","affiliations","author_with_affiliations","abstract","author_keywords","index_keywords","document_type","publication_stage","open_access","source","eid","screened_abstracts_i","notes_i","screened_abstracts","notes"
"ref_338","Freeman R.","55685280100;","A theory on the future of the rebound effect in a resource-constrained world",2018,"Frontiers in Energy Research","6","AUG","81",NA,NA,NA,8,"10.3389/fenrg.2018.00081","https://www.scopus.com/inward/record.uri?eid=2-s2.0-85052849073&doi=10.3389%2ffenrg.2018.00081&partnerID=40&md5=bd011f586f5a689e58336bd7d3c96ee1","UK Energy Research Centre and Tyndall Centre for Climate Change Research, School of Mechanical, Aerospace and Civil Engineering, The University of Manchester, Manchester, United Kingdom","Freeman, R., UK Energy Research Centre and Tyndall Centre for Climate Change Research, School of Mechanical, Aerospace and Civil Engineering, The University of Manchester, Manchester, United Kingdom","The paradox underlying the rebound effect is that, due to secondary effects, improvements in resource efficiency provide smaller reductions in the consumption of energy and/or material resources than are expected-or even an overall net increase in resource use. The rebound effect has played a role in economic growth and industrialization, yet it remains a problem for the task of reducing negative environmental impacts. This paper proposes that the size of the rebound effect, and the type of impacts it causes, may be affected by future changes in the system within which it arises. Four types of rebound effect are considered: economy-wide effects, transformational effects, frontier effects, and international rebound effects. A conceptual model of the historical role of the rebound effect in socio-technical systems, and the relationship of socio-technical systems with natural capital and human-created capital, provides a ""sandbox"" for testing ideas about the future. The model theory draws upon the concepts of natural capital, the Global Ecological Footprint, and the Great Acceleration. How the size of four types of the rebound effect might change in future, as supplies of resources from natural capital become more constrained, is discussed within three storylines. In the first storyline, natural capital declines but remains fairly stable; rebound is much decreased as resources are less available and efficiency is used up more in stabilizing supplies of goods and services. In the second storyline, growth continues without constraint amid regional rivalry; eventually there is a strong downturn in availability of resources and negative impacts on both society and natural capital. In the third storyline, impact caps are implemented for different types of resources; for some time, industry and society adapt by investing in low resource-use innovation and global cooperation on management of natural capital; once natural capital recovers and stabilizes, growth and consumption may increase along with the rebound effect, but staying within a Global Ecological Footprint of 1 Earth. The theory and model in this paper are intended to contribute to new thinking on the subject of the rebound effect. © 2018 Freeman.","Global Ecological Footprint; Natural capital; Socio-technical systems; System dynamics; The rebound effect","Environmental impact; Industrial economics; Natural resources management; Ecological footprint; Natural capital; Rebound effect; Sociotechnical systems; System Dynamics; Economic analysis","Article","Final",NA,"Scopus","2-s2.0-85052849073","selected","Rebounding effect literature","excluded","System dynamics"
"ref_346","Masi F. and Rizzo A. and Regelsberger M.","7003904837;56479999700;19640523300;","The role of constructed wetlands in a new circular economy, resource oriented, and ecosystem services paradigm",2018,"Journal of Environmental Management","216",NA,NA,275,284,NA,35,"10.1016/j.jenvman.2017.11.086","https://www.scopus.com/inward/record.uri?eid=2-s2.0-85044512177&doi=10.1016%2fj.jenvman.2017.11.086&partnerID=40&md5=8a169a15ecebff93f91a5152e5219750","IRIDRA Srl, Via La Marmora 51, Florence, 50121, Italy; Technisches Büro Regelsberger, Marburger Gasse 11, Gleisdorf, 8200, Austria","Masi, F., IRIDRA Srl, Via La Marmora 51, Florence, 50121, Italy; Rizzo, A., IRIDRA Srl, Via La Marmora 51, Florence, 50121, Italy; Regelsberger, M., Technisches Büro Regelsberger, Marburger Gasse 11, Gleisdorf, 8200, Austria","Wastewater management is included in one of the 17 Sustainable Development Goals (SDGs): SDG 6 is dedicated to water and sanitation and sets out to “ensure availability and sustainable management of water and sanitation for all”. SDG 6 expands the Millennium Development Goals (MDGs) focus on drinking water and basic sanitation to now cover the entire water cycle, including the management of water, wastewater and ecosystem resources. A UN report in 2017 states that likely over 80% of the wastewater worldwide is still discharged without adequate treatment. In several countries the wastewater management is nowadays a norm, but still there are open discussions about the kind of approach to be adopted, i.e. centralisation vs. decentralisation. The choice of the adopted technologies is strictly linked to environmental performances and economical aspects; one of the possible causes for the still enormous amount of untreated wastewater discharged into the environment can be the low “willingness to pay” for this kind of service and therefore a great focus should be given to all the technologies that are able to lower the treatment costs still maintaining reliable and robust performances in the long term. When considering wastewater as a carrier of valuable primary chemicals that can be easily converted to marketable products (fertilisers, bio-plastics, soil conditioners, biofuels, etc.), and as well as a relevant source of “new water” to be used for specific purposes, wastewater and runoff management can be highlighted as one of the most exciting challenges and occasions for a sustainable development in the near future. The paper aims to clarify the future role of CWs in circular economy, resource-oriented, and ecosystem services approaches, which want to respond to sanitation worldwide and the future research needs. We give an overview on how the conventional wastewater treatment scheme (what we call “waste paradigm”) should move towards more sustainable water and biogeochemical cycles following the new resource-oriented, circular economy and ecosystem service views. On this basis, we review the potential application of CWs within this new, and needed, paradigm. Finally, a meta-analysis shows that the scientific community involved in CWs should put more effort in making CWs more suitable for these new tasks. © 2017 Elsevier Ltd","Circular economy; Constructed wetlands; Resource oriented sanitation; Treatment wetlands","biofuel; drinking water; fertilizer; plastic; biogeochemical cycle; constructed wetland; decentralization; drinking water; ecosystem service; Millenium Development Goal; sanitation; sustainable development; wastewater treatment; willingness to pay; Article; biogeochemical cycle; constructed wetland; economic aspect; ecosystem; runoff; sanitation; soil; sustainable development; technology; waste water; waste water management; water cycle; water treatment; ecosystem; environmental protection; meta analysis; sanitation; waste water; wetland; Conservation of Natural Resources; Ecosystem; Sanitation; Waste Water; Wetlands","Article","Final",NA,"Scopus","2-s2.0-85044512177","selected","SE in action as example","excluded","Aguas"
"ref_347","Ng E.-L. and Huerta Lwanga E. and Eldridge S.M. and Johnston P. and Hu H.-W. and Geissen V. and Chen D.","57194442231;23008813400;24528285700;7402074850;54410582200;6602225881;57201905289;","An overview of microplastic and nanoplastic pollution in agroecosystems",2018,"Science of the Total Environment","627",NA,NA,1377,1388,NA,231,"10.1016/j.scitotenv.2018.01.341","https://www.scopus.com/inward/record.uri?eid=2-s2.0-85041550682&doi=10.1016%2fj.scitotenv.2018.01.341&partnerID=40&md5=bf7e1297fde762781d94d4f2cfdadb60","School of Agriculture and Food, Faculty of Veterinary and Agricultural Sciences, The University of MelbourneVictoria  3010, Australia; Soil Physics and Land Management Group, Wageningen University & Research, Droevendaalsesteeg 4, Wageningen, 6708PB, Netherlands; Agroecologia, El Colegio de la Frontera Sur, Unidad Campeche Av Polígono s/n, Cd. Industrial, Lerma, Campeche, Mexico; CSIRO Manufacturing, Bayview Avenue, Clayton, Victoria  3168, Australia","Ng, E.-L., School of Agriculture and Food, Faculty of Veterinary and Agricultural Sciences, The University of MelbourneVictoria  3010, Australia; Huerta Lwanga, E., Soil Physics and Land Management Group, Wageningen University & Research, Droevendaalsesteeg 4, Wageningen, 6708PB, Netherlands, Agroecologia, El Colegio de la Frontera Sur, Unidad Campeche Av Polígono s/n, Cd. Industrial, Lerma, Campeche, Mexico; Eldridge, S.M., School of Agriculture and Food, Faculty of Veterinary and Agricultural Sciences, The University of MelbourneVictoria  3010, Australia; Johnston, P., CSIRO Manufacturing, Bayview Avenue, Clayton, Victoria  3168, Australia; Hu, H.-W., School of Agriculture and Food, Faculty of Veterinary and Agricultural Sciences, The University of MelbourneVictoria  3010, Australia; Geissen, V., Soil Physics and Land Management Group, Wageningen University & Research, Droevendaalsesteeg 4, Wageningen, 6708PB, Netherlands; Chen, D., School of Agriculture and Food, Faculty of Veterinary and Agricultural Sciences, The University of MelbourneVictoria  3010, Australia","Microplastics and nanoplastics are emerging pollutants of global importance. They are small enough to be ingested by a wide range of organisms and at nano-scale, they may cross some biological barriers. However, our understanding of their ecological impact on the terrestrial environment is limited. Plastic particle loading in agroecosystems could be high due to inputs of some recycled organic waste and plastic film mulching, so it is vital that we develop a greater understanding of any potentially harmful or adverse impacts of these pollutants to agroecosystems. In this article, we discuss the sources of plastic particles in agroecosystems, the mechanisms, constraints and dynamic behaviour of plastic during aging on land, and explore the responses of soil organisms and plants at different levels of biological organisation to plastic particles of micro and nano-scale. Based on limited evidence at this point and understanding that the lack of evidence of ecological impact from microplastic and nanoplastic in agroecosystems does not equate to the evidence of absence, we propose considerations for addressing the gaps in knowledge so that we can adequately safeguard world food supply. © 2018","Ecotoxicology; Plant response; Plastic degradation; Soil food web; Soils","Food supply; Nanotechnology; Pollution; Soils; Eco-toxicology; Ecological impacts; Emerging pollutants; Plant response; Plastic degradation; Plastic film mulching; Soil food web; Terrestrial environments; Ecosystems; agricultural ecosystem; degradation; ecotoxicology; food web; plant; plastic waste; pollutant source; soil pollution; agroecosystem; environmental impact; food web; microplastic pollution; nanoplastic pollution; nonhuman; particle size; plant damage; plant growth; pollution; priority journal; Review; risk assessment; soil analysis; soil chemistry; soil microflora; soil pollution; soil quality; agriculture; analysis; ecosystem; environmental monitoring; soil pollutant; plastic; Agriculture; Ecosystem; Environmental Monitoring; Plastics; Soil Pollutants","Review","Final",NA,"Scopus","2-s2.0-85041550682","selected","Micro and nano plastic porllution literature","excluded","Microplastics"
"ref_349","Burlakovs J. and Jani Y. and Kriipsalu M. and Vincevica-Gaile Z. and Kaczala F. and Celma G. and Ozola R. and Rozina L. and Rudovica V. and Hogland M. and Viksna A. and Pehme K.-M. and Hogland W. and Klavins M.","55583010900;56367897600;20434310600;55652554000;24474718000;57201741056;57192545569;57201745477;55776406300;56462875400;7004704943;57197767658;57194220854;6701827140;","On the way to ‘zero waste’ management: Recovery potential of elements, including rare earth elements, from fine fraction of waste",2018,"Journal of Cleaner Production","186",NA,NA,81,90,NA,35,"10.1016/j.jclepro.2018.03.102","https://www.scopus.com/inward/record.uri?eid=2-s2.0-85046016140&doi=10.1016%2fj.jclepro.2018.03.102&partnerID=40&md5=ee7ddbd138428405ce46c4bb82b62974","Linnaeus University, Nygatan 18B, Kalmar, 392 34, Sweden; University of Latvia, Raina Blvd. 19, Riga, LV-1586, Latvia; Estonian University of Life Sciences, Friedrich Reinhold Kreutzwaldi 1, Tartu, 51014, Estonia","Burlakovs, J., Linnaeus University, Nygatan 18B, Kalmar, 392 34, Sweden; Jani, Y., Linnaeus University, Nygatan 18B, Kalmar, 392 34, Sweden; Kriipsalu, M., Estonian University of Life Sciences, Friedrich Reinhold Kreutzwaldi 1, Tartu, 51014, Estonia; Vincevica-Gaile, Z., University of Latvia, Raina Blvd. 19, Riga, LV-1586, Latvia; Kaczala, F., Linnaeus University, Nygatan 18B, Kalmar, 392 34, Sweden; Celma, G., University of Latvia, Raina Blvd. 19, Riga, LV-1586, Latvia; Ozola, R., University of Latvia, Raina Blvd. 19, Riga, LV-1586, Latvia; Rozina, L., University of Latvia, Raina Blvd. 19, Riga, LV-1586, Latvia; Rudovica, V., University of Latvia, Raina Blvd. 19, Riga, LV-1586, Latvia; Hogland, M., Linnaeus University, Nygatan 18B, Kalmar, 392 34, Sweden; Viksna, A., University of Latvia, Raina Blvd. 19, Riga, LV-1586, Latvia; Pehme, K.-M., Estonian University of Life Sciences, Friedrich Reinhold Kreutzwaldi 1, Tartu, 51014, Estonia; Hogland, W., Linnaeus University, Nygatan 18B, Kalmar, 392 34, Sweden; Klavins, M., University of Latvia, Raina Blvd. 19, Riga, LV-1586, Latvia","Existing schemes of solid waste handling have been improved implementing advanced systems for recovery and reuse of various materials. Nowadays, the ‘zero waste’ concept is becoming more topical through the reduction of disposed waste. Recovery of metals, nutrients and other materials that can be returned to the material cycles still remain as a challenge for future. Landfill mining (LFM) is one of the approaches that can deal with former dumpsites, and derived materials may become important for circular economy within the concept ‘beyond the zero waste’. Perspectives of material recovery can include recycling of critical industrial metals, including rare earth elements (REEs). The LFM projects performed in the Baltic Region along with a conventional source separation of iron-scrap, plastics etc. have shown that the potential of fine-grained fractions (including clay and colloidal matter) of excavated waste have considerably large amounts of potentially valuable metals and distinct REEs. In this paper analytical screening studies are discussed extending the understanding of element content in fine fraction of waste derived from excavated, separated and screened waste in a perspective of circular economy. Technological feasibility was evaluated by using modified sequential extraction technique where easy extractable amount of metals can be estimated. Results revealed that considerable concentrations of Mn (418–823 mg/kg), Ni (41–84 mg/kg), Co (10.7–19.3 mg/kg) and Cd (1.0–3.0 mg/kg) were detected in fine fraction (<10 mm) of waste sampled from Högbytorp landfill, while Cr (49–518 mg/kg) and Pb (30–264 mg/kg) were found in fine fraction (<10 mm) of waste from Torma landfill revealing wide heterogeneity of tested samples. Waste should become a utilizable resource closing the loop of anthropogenic material cycle as the hidden potential of valuable materials in dumps is considerable. © 2018 Elsevier Ltd","Circular economy; Element recovery; Landfill mining; Waste valorisation; Zero waste concept","Iron scrap; Land fill; Materials handling; Rare earth elements; Rare earths; Scrap metal reprocessing; Source separation; Circular economy; Finegrained fractions; Landfill mining; Rare earth elements (REEs); Sequential extraction technique; Technological feasibility; Valorisation; Zero waste; Extraction","Article","Final",NA,"Scopus","2-s2.0-85046016140","selected",NA,"excluded","Zero waste"
"ref_350","Zhao F. and Yang L. and Chen L. and Li G. and Sun L. and Li S.","57203847192;57049928700;35733404900;56384560200;56147016400;56651406000;","Soil security in peri-urban ecosystems: Problems and challenges",2018,"Shengtai Xuebao/ Acta Ecologica Sinica","38","12",NA,4109,4120,NA,1,"10.5846/stxb201801310263","https://www.scopus.com/inward/record.uri?eid=2-s2.0-85050639317&doi=10.5846%2fstxb201801310263&partnerID=40&md5=70c7e5255ecc13e08c7e9014dd0c1227","State Key Laboratory of Urban and Regional Ecology, Research Center for Eco-Environmental Sciences, Chinese Academy of Sciences, Beijing, 100085, China; University of Chinese, Academy of Sciences, Beijing, 100049, China; Key Laboratory of Urban Environment and Health, Institute of Urban Environment, Chinese Academy of Sciences, Xiamen, 361021, China","Zhao, F., State Key Laboratory of Urban and Regional Ecology, Research Center for Eco-Environmental Sciences, Chinese Academy of Sciences, Beijing, 100085, China, University of Chinese, Academy of Sciences, Beijing, 100049, China; Yang, L., State Key Laboratory of Urban and Regional Ecology, Research Center for Eco-Environmental Sciences, Chinese Academy of Sciences, Beijing, 100085, China; Chen, L., State Key Laboratory of Urban and Regional Ecology, Research Center for Eco-Environmental Sciences, Chinese Academy of Sciences, Beijing, 100085, China, University of Chinese, Academy of Sciences, Beijing, 100049, China; Li, G., Key Laboratory of Urban Environment and Health, Institute of Urban Environment, Chinese Academy of Sciences, Xiamen, 361021, China; Sun, L., State Key Laboratory of Urban and Regional Ecology, Research Center for Eco-Environmental Sciences, Chinese Academy of Sciences, Beijing, 100085, China; Li, S., State Key Laboratory of Urban and Regional Ecology, Research Center for Eco-Environmental Sciences, Chinese Academy of Sciences, Beijing, 100085, China, University of Chinese, Academy of Sciences, Beijing, 100049, China","Soil is considered the key connection for material and energy transfer and transformation in the Earth's surface layer. Soil's components and ecological functions have been dramatically affected by rapid urbanization in recent decades. This is especially true for peri-urban ecosystems. A peri-urban ecosystem comprises the interaction and transition zones between urban and rural or natural ecosystems. Soils in peri-urban ecosystems are identified with both urban and rural/natural ecosystems' structural and functional features, and are prone to being affected by urbanization pressures. Soils in peri-urban ecosystems provide essential life-support functions and ecosystem services for urban and rural residents, including food supply, water purification, water conservation, contamination interception, leisure and entertainment services, cultural services, and more. Under rapid urbanization, a large area of agricultural and natural landscapes are converted to urban landscapes. Soils in peri-urban ecosystems therefore tend to be significantly disturbed because of increasing human activities, which change the soil processes and reduce the quality and diversity of soil functions such as food production, pollution attenuation, hydrological cycling, and energy balance. The inherent conflicts between urbanization and soil security have been studied for a long time. As urbanization levels in peri-urban ecosystems have increased, soil security problems in peri-urban ecosystems have been a key issue in recent studies. This study reviews published literature concerning soil security in peri-urban ecosystems and aims to contribute to scientific understanding of the interrelations between soil security and urbanization. Statistical analysis showed that the number of published papers concerning peri-urban ecosystems rapidly increased after 2000, especially in the past 5 years. Many studies concerning soil security were focused on urbanization' s influence on soil processes in urban areas, including cropland loss, food production, climate change, and other processes linked with soils. However, only a limited number of studies that focused on peri-urban areas were found. The soil security problems in peri-urban ecosystem areas were often ignored by both rural and urban ecosystems research. In this review, the particularity and complexity of soil security in peri-urban ecosystems are discussed. In summary, we suggest that future peri-urban studies should focus on the following issues: (1) exploring comparative studies at a large scale under different urban sprawl modes, (2) exploring the tradeoff of ecosystem services in the framework of soil security in peri-urban ecosystems, and perspectives on current solutions for soil security in peri-urban ecosystems are proposed, (3) exploring the sources of contaminants in soil and their co-contamination in peri-urban ecosystems, and optimizing landscape patterns to promote soil security and ecosystem services, and (4) considering the sustainable development goals of peri-urban ecosystems and highlighting the multi-dimensional role of soil security in sustainable policy and management. Because soils in peri-urban ecosystems have their own unique set of socioeconomic and ecological features, soil security should be emphasized for understanding the environmental response to global urbanization. © 2018 Science Press. All rights reserved.","Landscape pattern; Peri-urban ecosystem; Soil security; Urbanization","complexity; Earth structure; ecosystem function; ecosystem service; environmental response; landscape ecology; literature review; soil pollution; sustainable development; urban ecosystem; urban sprawl; urbanization","Article","Final",NA,"Scopus","2-s2.0-85050639317","selected","Maybe for ecosystems services on soil","excluded","Soil"
