"label","author","author_s_id","title","year","source_title","volume","issue","art_no","page_start","page_end","page_count","cited_by","doi","link","affiliations","author_with_affiliations","abstract","author_keywords","index_keywords","document_type","publication_stage","open_access","source","eid","screened_abstracts_i","notes_i","screened_abstracts","notes"
"ref_193","García-Velásquez C.A. and Leduc S. and Van Der Meer Y.","57202605288;25643113700;57192667713;","Use of optimization tools for decision-making: Accounting for externalities in the production of biobased plastics",2020,"European Biomass Conference and Exhibition Proceedings",NA,NA,NA,987,996,NA,NA,NA,"https://www.scopus.com/inward/record.uri?eid=2-s2.0-85097388922&partnerID=40&md5=dd74db964bc005094404654b6c51e725","Aachen-Maastricht Institute for Biobased Materials (AMIBM), Maastricht University, Netherlands; International Institute for Applied Science Analysis (IIASA), Laxenburg, Austria","García-Velásquez, C.A., Aachen-Maastricht Institute for Biobased Materials (AMIBM), Maastricht University, Netherlands; Leduc, S., International Institute for Applied Science Analysis (IIASA), Laxenburg, Austria; Van Der Meer, Y., Aachen-Maastricht Institute for Biobased Materials (AMIBM), Maastricht University, Netherlands","Plastic is one of the most versatile materials, but its production relies on fossil-based resources that have been linked to the increase in GHG emissions. In this sense, biobased plastics arise as an alternative to completely or partly substitute these fossil-based plastics. Nevertheless, it is still unclear if the use of biomass for the production of bioplastics can mitigate the environmental impact of fossil-based plastics and simultaneously provide economic benefits. The proper design of biomass supply chains plays an important role in the development of biobased plastics; however, economic criteria (e.g., maximization of revenues) is the most used parameter to optimize the supply chain, whereas environmental criteria are barely considered. For this purpose, we propose an optimization model that evaluates different supply chain configurations for the production of biobased polyethylene terephthalate (PET) using sugar beet and wheat. The optimization model accounts for the production costs and environmental costs through different methodologies, such as the Life Cycle Costing (LCC) and Life Cycle Assessment (LCA), respectively. We found that the production of biobased terephthalic acid (TPA) directly influences the economic profitability of 100% biobased PET. The selection of feedstock and carbon tax scenario play an important role in the development of biobased supply chains. © 2020, ETA-Florence Renewable Energies. All Rights Reserved.","Biopolymers; Decision Support; Life Cycle Assessment (LCA); Sugar Beet; Supply Chain",NA,"Conference Paper","Final",NA,"Scopus","2-s2.0-85097388922","selected","LCA for supply chain for Plastic value chain?","excluded","Bioplastics Externalities "
"ref_195","Landrigan P.J. and Stegeman J.J. and Fleming L.E. and Allemand D. and Anderson D.M. and Backer L.C. and Brucker-Davis F. and Chevalier N. and Corra L. and Czerucka D. and Bottein M.-Y.D. and Demeneix B. and Depledge M. and Deheyn D.D. and Dorman C.J., Fénichel P. and Fisher S. and Gaill F. and Galgani F. and Gaze W.H. and Giuliano L. and Grandjean P. and Hahn M.E. and Hamdoun A. and Hess P. and Judson B. and Laborde A. and McGlade J. and Mu J. and Mustapha A. and Neira M. and Noble R.T. and Pedrotti M.L. and Reddy C. and Rocklöv J. and Scharler U.M. and Shanmugam H. and Taghian G. and Van De Water J.A.J.M. and Vezzulli L. and Weihe P. and Zeka A. and Raps H. and Rampal P.","7102250584;7102520937;7103387986;7003604806;7410018378;35459742800;6603801483;7006309506;19638730200;6603686136;57204548657;7007031714;7006303023;6701653476;57221048418;55172216700;57202122444;35579738100;7004182890;6507747432;7003664834;7102566262;57221051146;57204496723;8593066900;57221053375;7004350511;8438762300;57221052811;57220122788;7004024861;7202390115;56005007500;7403177433;18038015300;6507990601;38862948300;57221054074;55487199400;6603604913;7003676104;55965811000;57221053767;57221046629;","Human health and ocean pollution",2020,"Annals of Global Health","86","1","151",1,64,NA,2,"10.5334/aogh.2831","https://www.scopus.com/inward/record.uri?eid=2-s2.0-85098047537&doi=10.5334%2faogh.2831&partnerID=40&md5=6f9daf554b0d6b1d959148a315305fe9","Boston College, United States; Woods Hole Center for Oceans and Human Health, Woods Hole Oceanographic Institution, United States; European Centre for Environment and Human Health, United Kingdom; University of Exeter Medical School, United Kingdom; Centre Scientifique de Monaco, Monaco; Centers for Disease Control and Prevention, United States; Université Côte d’Azur, France; Centre Hospitalier Universitaire de Nice, Inserm, C3M, France; International Society of Doctors for the Environment (ISDE), Switzerland; Health and Environment of the Global Alliance on Health and Pollution (GAHP); Intergovernmental Oceanographic Commission of UNESCO, France; IOC Science and Communication Centre on Harmful Algae, University of Copenhagen, Denmark; Ecotoxicologie et développement durable expertise ECODD, Valbonne, France; Centre National de la Recherche Scientifique, France; Muséum National d’Histoire Naturelle, Paris, France; Scripps Institution of Oceanography, University of California San Diego, United States; Trinity College Dublin, Ireland; Institut Français de Recherche pour l’Exploitation des Mers, France; University of Exeter, United Kingdom; CIESM The Mediterranean Science Commission, Monaco; Harvard University T.H. Chan School of Public Health, United States; University of California at San Diego, United States; Universidad de la República, Uruguay; Institute for Global Prosperity, University College London, United Kingdom; Strathmore University Business School, Nairobi, Kenya; Nigerian Institute for Medical Research, Lagos, Nigeria; Imperial College London, United Kingdom; World Health Organization, Switzerland; University of North Carolina, Chapel Hill, United States; Sorbonne Université, France; Department of Marine Chemistry and Geochemistry, Woods Hole Oceanographic Institution, United States; Department of Public Health and Clinical Medicine, Section of Sustainable Health, Umeå University, Umeå, Sweden; University of KwaZulu-Natal, South Africa; University of Genoa, Italy; University of the Faroe Islands and Department of Occupational Medicine and Public Health, Faroe Islands; Brunel University London, United Kingdom; WHO Collaborating Centre for Health and Sustainable Development, Monaco","Landrigan, P.J., Boston College, United States; Stegeman, J.J., Woods Hole Center for Oceans and Human Health, Woods Hole Oceanographic Institution, United States; Fleming, L.E., European Centre for Environment and Human Health, United Kingdom, University of Exeter Medical School, United Kingdom; Allemand, D., Centre Scientifique de Monaco, Monaco; Anderson, D.M., Woods Hole Center for Oceans and Human Health, Woods Hole Oceanographic Institution, United States; Backer, L.C., Centers for Disease Control and Prevention, United States; Brucker-Davis, F., Université Côte d’Azur, France, Centre Hospitalier Universitaire de Nice, Inserm, C3M, France; Chevalier, N., Université Côte d’Azur, France, Centre Hospitalier Universitaire de Nice, Inserm, C3M, France; Corra, L., International Society of Doctors for the Environment (ISDE), Switzerland, Health and Environment of the Global Alliance on Health and Pollution (GAHP); Czerucka, D., Centre Scientifique de Monaco, Monaco; Bottein, M.-Y.D., Intergovernmental Oceanographic Commission of UNESCO, France, IOC Science and Communication Centre on Harmful Algae, University of Copenhagen, Denmark, Ecotoxicologie et développement durable expertise ECODD, Valbonne, France; Demeneix, B., Centre National de la Recherche Scientifique, France, Muséum National d’Histoire Naturelle, Paris, France; Depledge, M., University of Exeter Medical School, United Kingdom; Deheyn, D.D., Scripps Institution of Oceanography, University of California San Diego, United States; Dorman, C.J., Trinity College Dublin, Ireland; Fénichel, P., Université Côte d’Azur, France, Centre Hospitalier Universitaire de Nice, Inserm, C3M, France; Fisher, S., Boston College, United States; Gaill, F., Centre National de la Recherche Scientifique, France; Galgani, F., Institut Français de Recherche pour l’Exploitation des Mers, France; Gaze, W.H., University of Exeter, United Kingdom; Giuliano, L., CIESM The Mediterranean Science Commission, Monaco; Grandjean, P., Harvard University T.H. Chan School of Public Health, United States; Hahn, M.E., Woods Hole Center for Oceans and Human Health, Woods Hole Oceanographic Institution, United States; Hamdoun, A., University of California at San Diego, United States; Hess, P., Institut Français de Recherche pour l’Exploitation des Mers, France; Judson, B., Boston College, United States; Laborde, A., Universidad de la República, Uruguay; McGlade, J., Institute for Global Prosperity, University College London, United Kingdom, Strathmore University Business School, Nairobi, Kenya; Mu, J., Boston College, United States; Mustapha, A., Nigerian Institute for Medical Research, Lagos, Nigeria, Imperial College London, United Kingdom; Neira, M., World Health Organization, Switzerland; Noble, R.T., University of North Carolina, Chapel Hill, United States; Pedrotti, M.L., Centre National de la Recherche Scientifique, France, Sorbonne Université, France; Reddy, C., Department of Marine Chemistry and Geochemistry, Woods Hole Oceanographic Institution, United States; Rocklöv, J., Department of Public Health and Clinical Medicine, Section of Sustainable Health, Umeå University, Umeå, Sweden; Scharler, U.M., University of KwaZulu-Natal, South Africa; Shanmugam, H., Boston College, United States; Taghian, G., Boston College, United States; Van De Water, J.A.J.M., Centre Scientifique de Monaco, Monaco; Vezzulli, L., University of Genoa, Italy; Weihe, P., University of the Faroe Islands and Department of Occupational Medicine and Public Health, Faroe Islands; Zeka, A., Brunel University London, United Kingdom; Raps, H., Centre Scientifique de Monaco, Monaco; Rampal, P., Boston College, United States, WHO Collaborating Centre for Health and Sustainable Development, Monaco","Background: Pollution – unwanted waste released to air, water, and land by human activity – is the largest environmental cause of disease in the world today. It is responsible for an estimated nine million premature deaths per year, enormous economic losses, erosion of human capital, and degradation of ecosystems. Ocean pollution is an important, but insufficiently recognized and inadequately controlled component of global pollution. It poses serious threats to human health and well-being. The nature and magnitude of these impacts are only beginning to be understood. Goals: (1) Broadly examine the known and potential impacts of ocean pollution on human health. (2) Inform policy makers, government leaders, international organizations, civil society, and the global public of these threats. (3) Propose priorities for interventions to control and prevent pollution of the seas and safeguard human health. Methods: Topic-focused reviews that examine the effects of ocean pollution on human health, identify gaps in knowledge, project future trends, and offer evidence-based guidance for effective intervention. Environmental Findings: Pollution of the oceans is widespread, worsening, and in most countries poorly controlled. It is a complex mixture of toxic metals, plastics, manufactured chemicals, petroleum, urban and industrial wastes, pesticides, fertilizers, pharmaceutical chemicals, agricultural runoff, and sewage. More than 80% arises from land-based sources. It reaches the oceans through rivers, runoff, atmospheric deposition and direct discharges. It is often heaviest near the coasts and most highly concentrated along the coasts of low- and middle-income countries. Plastic is a rapidly increasing and highly visible component of ocean pollution, and an estimated 10 million metric tons of plastic waste enter the seas each year. Mercury is the metal pollutant of greatest concern in the oceans; it is released from two main sources – coal combustion and small-scale gold mining. Global spread of industrialized agriculture with increasing use of chemical fertilizer leads to extension of Harmful Algal Blooms (HABs) to previously unaffected regions. Chemical pollutants are ubiquitous and contaminate seas and marine organisms from the high Arctic to the abyssal depths. Ecosystem Findings: Ocean pollution has multiple negative impacts on marine ecosystems, and these impacts are exacerbated by global climate change. Petroleum-based pollutants reduce photosynthesis in marine microorganisms that generate oxygen. Increasing absorption of carbon dioxide into the seas causes ocean acidification, which destroys coral reefs, impairs shellfish development, dissolves calcium-containing microorganisms at the base of the marine food web, and increases the toxicity of some pollutants. Plastic pollution threatens marine mammals, fish, and seabirds and accumulates in large mid-ocean gyres. It breaks down into microplastic and nanoplastic particles containing multiple manufactured chemicals that can enter the tissues of marine organisms, including species consumed by humans. Industrial releases, runoff, and sewage increase frequency and severity of HABs, bacterial pollution, and anti-microbial resistance. Pollution and sea surface warming are triggering poleward migration of dangerous pathogens such as the Vibrio species. Industrial discharges, pharmaceutical wastes, pesticides, and sewage contribute to global declines in fish stocks. Human Health Findings: Methylmercury and PCBs are the ocean pollutants whose human health effects are best understood. Exposures of infants in utero to these pollutants through maternal consumption of contaminated seafood can damage developing brains, reduce IQ and increase children’s risks for autism, ADHD and learning disorders. Adult exposures to methylmercury increase risks for cardiovascular disease and dementia. Manufactured chemicals – phthalates, bisphenol A, flame retardants, and perfluorinated chemicals, many of them released into the seas from plastic waste – can disrupt endocrine signaling, reduce male fertility, damage the nervous system, and increase risk of cancer. HABs produce potent toxins that accumulate in fish and shellfish. When ingested, these toxins can cause severe neurological impairment and rapid death. HAB toxins can also become airborne and cause respiratory disease. Pathogenic marine bacteria cause gastrointestinal diseases and deep wound infections. With climate change and increasing pollution, risk is high that Vibrio infections, including cholera, will increase in frequency and extend to new areas. All of the health impacts of ocean pollution fall disproportionately on vulnerable populations in the Global South – environmental injustice on a planetary scale. Conclusions: Ocean pollution is a global problem. It arises from multiple sources and crosses national boundaries. It is the consequence of reckless, shortsighted, and unsustainable exploitation of the earth’s resources. It endangers marine ecosystems. It impedes the production of atmospheric oxygen. Its threats to human health are great and growing, but still incompletely understood. Its economic costs are only beginning to be counted. Ocean pollution can be prevented. Like all forms of pollution, ocean pollution can be controlled by deploying data-driven strategies based on law, policy, technology, and enforcement that target priority pollution sources. Many countries have used these tools to control air and water pollution and are now applying them to ocean pollution. Successes achieved to date demonstrate that broader control is feasible. Heavily polluted harbors have been cleaned, estuaries rejuvenated, and coral reefs restored. Prevention of ocean pollution creates many benefits. It boosts economies, increases tourism, helps restore fisheries, and improves human health and well-being. It advances the Sustainable Development Goals (SDG). These benefits will last for centuries. Recommendations: World leaders who recognize the gravity of ocean pollution, acknowledge its growing dangers, engage civil society and the global public, and take bold, evidence-based action to stop pollution at source will be critical to preventing ocean pollution and safeguarding human health. Prevention of pollution from land-based sources is key. Eliminating coal combustion and banning all uses of mercury will reduce mercury pollution. Bans on single-use plastic and better management of plastic waste reduce plastic pollution. Bans on persistent organic pollutants (POPs) have reduced pollution by PCBs and DDT. Control of industrial discharges, treatment of sewage, and reduced applications of fertilizers have mitigated coastal pollution and are reducing frequency of HABs. National, regional and international marine pollution control programs that are adequately funded and backed by strong enforcement have been shown to be effective. Robust monitoring is essential to track progress. Further interventions that hold great promise include wide-scale transition to renewable fuels; transition to a circular economy that creates little waste and focuses on equity rather than on endless growth; embracing the principles of green chemistry; and building scientific capacity in all countries. Designation of Marine Protected Areas (MPAs) will safeguard critical ecosystems, protect vulnerable fish stocks, and enhance human health and well-being. Creation of MPAs is an important manifestation of national and international commitment to protecting the health of the seas. © 2020 The Author(s).",NA,"aromatic hydrocarbon; cosmetic; flame retardant; halogenated hydrocarbon; mercury; methylmercury; microplastic; organometallic compound; perfluoro compound; pesticide; polycyclic aromatic hydrocarbon; toxic substance; acidification; algal bloom; antibiotic resistance; Article; bacterium; carcinogenesis; cardiovascular disease; climate change; coastal waters; cognition; developmental disorder; diabetes mellitus; dietary pattern; ecotoxicity; endocrine disease; environmental monitoring; environmental protection; evidence based practice; fish stock; fishery; global disease burden; greenhouse effect; health; health hazard; human; immunotoxicity; marine alga; marine environment; marine species; metabolic syndrome X; microplastic pollution; mortality; motor vehicle tire; neurotoxicity; nonhuman; ocean environment; oil spill; plastic pollution; prevention and control; protozoon; risk factor; sea; sea pollution; Vibrio; virus; water pollutant; water pollution control","Article","Final",NA,"Scopus","2-s2.0-85098047537","selected","Yes on ocean pollutions","excluded","Ocean"
"ref_196","Straka M. and Taušová M. and Rosová A. and Cehlár M. and Kačmáry P. and Sisol M. and Ignácz P. and Farkas C.","36775833200;16308121100;55555816100;6506888229;35519833400;25621767800;57214153239;57205293470;","Big data analytics of a waste recycling simulation logistics system",2020,"Polish Journal of Environmental Studies","29","3",NA,2355,2364,NA,2,"10.15244/pjoes/108684","https://www.scopus.com/inward/record.uri?eid=2-s2.0-85084243880&doi=10.15244%2fpjoes%2f108684&partnerID=40&md5=2058ebebea61890b55ca145ea2249965","Institute of Logistics and Transport, BERG Faculty, Technical University of Kosice, Kosice, Slovakia; Institute of Earth Resources, BERG Faculty, Technical University of Kosice, Kosice, Slovakia","Straka, M., Institute of Logistics and Transport, BERG Faculty, Technical University of Kosice, Kosice, Slovakia; Taušová, M., Institute of Earth Resources, BERG Faculty, Technical University of Kosice, Kosice, Slovakia; Rosová, A., Institute of Logistics and Transport, BERG Faculty, Technical University of Kosice, Kosice, Slovakia; Cehlár, M., Institute of Earth Resources, BERG Faculty, Technical University of Kosice, Kosice, Slovakia; Kačmáry, P., Institute of Logistics and Transport, BERG Faculty, Technical University of Kosice, Kosice, Slovakia; Sisol, M., Institute of Earth Resources, BERG Faculty, Technical University of Kosice, Kosice, Slovakia; Ignácz, P., Institute of Logistics and Transport, BERG Faculty, Technical University of Kosice, Kosice, Slovakia; Farkas, C., Institute of Logistics and Transport, BERG Faculty, Technical University of Kosice, Kosice, Slovakia","Our paper is focused on data evaluation about the full recycling of waste by special statistical software and by using the principles of logistics. The paper goes further than the paper entitled “Environmental assessment of waste recycling based on principles of logistics and computer simulation design,” which outputs a number of data that need to be reviewed and evaluated separately. Data, representing 15 types of waste for 5 years, enter the analysis. There were the types of waste that make up the most important part of the total waste production by means of descriptive statistics. Thanks to this, they were identified as the most important (from the production point of view) plastic granules with an average of 755.05 t/month, glass with an average of 672.233 t/month and paper with the average of 645.25 t/month. The persistence of particular waste type generation was examined by the variation coefficient in order to reduce the risk of supply of these secondary raw materials in the downstream supply chain. Selected waste elements can be considered relatively stable with a variation coefficient in the range 2.4-4.1%; the least stable type is electronic dust with a coefficient of variation of up to almost 23%. © 2020, HARD Publishing Company. All rights reserved.","Environment; Evaluation; Logistics; Statistical analysis software; Waste recycling",NA,"Article","Final",NA,"Scopus","2-s2.0-85084243880","selected","Smart collector?","excluded","Big data and  recyling"
"ref_210","Tzaninis Y. and Mandler T. and Kaika M. and Keil R.","57035466000;57191953595;6603255279;7102728834;","Moving urban political ecology beyond the ‘urbanization of nature’",2020,"Progress in Human Geography",NA,NA,NA,NA,NA,NA,7,"10.1177/0309132520903350","https://www.scopus.com/inward/record.uri?eid=2-s2.0-85081566582&doi=10.1177%2f0309132520903350&partnerID=40&md5=d53ca10878dec9a31a716fca4655af82","University of Amsterdam, Netherlands; York University, Canada","Tzaninis, Y., University of Amsterdam, Netherlands; Mandler, T., University of Amsterdam, Netherlands; Kaika, M., University of Amsterdam, Netherlands; Keil, R., York University, Canada","Urban political ecology (UPE) focuses on unsettling traditional understandings of ‘cities’ as ontological entities separate from ‘nature’ and on how the production of settlements is metabolically linked with flows of capital and more-than-human ecological processes. The contribution of this paper is to recalibrate UPE to new urban forms and processes of extended urbanization. This exploration goes against the reduction of what goes on outside of cities to processes that emanate unidirectionally from cities. Acknowledging UPE’s rich intellectual history and aiming to enrich rather than split the field, this paper identifies four emerging discourses that go beyond UPE’s original formulation. © The Author(s) 2020.","more-than-human; situated; suburbanization; urban political ecology; urbanization of nature",NA,"Article","Article in Press",NA,"Scopus","2-s2.0-85081566582","selected","Urban ecology","excluded","Urban Ecology"
