"label","author","author_s_id","title","year","source_title","volume","issue","art_no","page_start","page_end","page_count","cited_by","doi","link","affiliations","author_with_affiliations","abstract","author_keywords","index_keywords","document_type","publication_stage","open_access","source","eid","screened_abstracts_i","notes_i","screened_abstracts","notes"
"ref_085","Abalansa S. and El Mahrad B. and Vondolia G.K. and Icely J. and Newton A.","57216706413;57209271531;34973499100;6506626316;7201391894;","The marine plastic litter issue: A social-economic analysis",2020,"Sustainability (Switzerland)","12","20","8677",1,27,NA,NA,"10.3390/su12208677","https://www.scopus.com/inward/record.uri?eid=2-s2.0-85093069745&doi=10.3390%2fsu12208677&partnerID=40&md5=97defe129291d80495f6502ad6fc82e3","Murray Foundation, Brabners LLP, Horton House, Exchange Street, Liverpool, L2 3YL, United Kingdom; CIMA, FCT-Gambelas Campus, University of Algarve, Faro, 8005-139, Portugal; Laboratory of Geoscience, Water and Environment, (LG2E-CERNE2D), Department of Earth Sciences, Faculty of Sciences, Mohammed V University of Rabat, Rabat, 10000, Morocco; Norwegian Institute for Water Research, Gaustadalléen 21, Oslo, 0349, Norway; Sagremarisco, Apt 21, Vila do Bispo, 8650-999, Portugal","Abalansa, S., Murray Foundation, Brabners LLP, Horton House, Exchange Street, Liverpool, L2 3YL, United Kingdom, CIMA, FCT-Gambelas Campus, University of Algarve, Faro, 8005-139, Portugal; El Mahrad, B., Murray Foundation, Brabners LLP, Horton House, Exchange Street, Liverpool, L2 3YL, United Kingdom, CIMA, FCT-Gambelas Campus, University of Algarve, Faro, 8005-139, Portugal, Laboratory of Geoscience, Water and Environment, (LG2E-CERNE2D), Department of Earth Sciences, Faculty of Sciences, Mohammed V University of Rabat, Rabat, 10000, Morocco; Vondolia, G.K., Norwegian Institute for Water Research, Gaustadalléen 21, Oslo, 0349, Norway; Icely, J., CIMA, FCT-Gambelas Campus, University of Algarve, Faro, 8005-139, Portugal, Sagremarisco, Apt 21, Vila do Bispo, 8650-999, Portugal; Newton, A., CIMA, FCT-Gambelas Campus, University of Algarve, Faro, 8005-139, Portugal","The issue of marine plastic litter pollution is multifaceted, cross-sectoral, and ongoing in the absence of appropriate management measures. This study analysed the issue of marine plastic litter pollution in the context of the Descriptor 10 of the Marine Strategy Framework Directive and Good Environmental Status of the oceans and seas. The Driver-Pressure-State-Impact-Response (DPSIR) framework was used to assess the causes, effects, and management measures to changes in the marine environment resulting from marine plastics pollution. We noted that less than 10 peer-reviewed publications have applied the Driver-Pressure-State-Impact-Response (DPSIR) model to the issue of marine plastics pollution. Some basic needs such as food security, movement of goods and services, and shelter are also some of the major drivers of marine plastic pollution. The use of plastics is linked to multiple economic sectors (fisheries, agriculture, transport, packaging, construction) and other human activities. A significant amount of the resulting pressures came from the economic sectors for packaging and construction. State changes occurred at the environmental (contamination and bioaccumulation), ecosystem (ingestion of plastics, ghost fishing) and ecosystem service levels (supply of sea food, salt and cultural benefits), with possible loss of jobs and income being some of the observed impacts on human welfare. Responses as management measures, which are tailored to meet each component of the DPSIR framework, were identified. These included policies, regulations, technological advancement and behavioural change. The research acknowledges the issue of marine plastics pollution as a global environmental problem and recommends a trans-disciplinary approach, involving all types of stakeholders. Future research and analysis applying the DPSIR framework will be useful to provide the information necessary for the effective, adaptive management of litter pollution by marine plastics. © 2020 by the authors. Licensee MDPI, Basel, Switzerland.","DPSIR; Economic sectors; Good Environmental Status; Marine plastic litter; Marine Strategy Framework Directive","adaptive management; ecosystem service; environmental management; human activity; marine environment; marine pollution; plastic; socioeconomic conditions; strategic approach","Article","Final",NA,"Scopus","2-s2.0-85093069745","selected","Maybe Global Issues","excluded","Marine litter"
"ref_089","Li W. and Achal V.","57191751121;15076974200;","Environmental and health impacts due to e-waste disposal in China – A review",2020,"Science of the Total Environment","737",NA,"139745",NA,NA,NA,3,"10.1016/j.scitotenv.2020.139745","https://www.scopus.com/inward/record.uri?eid=2-s2.0-85085841848&doi=10.1016%2fj.scitotenv.2020.139745&partnerID=40&md5=918c2b08de3ef48c273824ddd817aae5","Environmental Engineering Program, Guangdong Technion – Israel Institute of Technology, Shantou, 515063, China; Technion – Israel Institute of Technology, Haifa, 32000, Israel","Li, W., Environmental Engineering Program, Guangdong Technion – Israel Institute of Technology, Shantou, 515063, China, Technion – Israel Institute of Technology, Haifa, 32000, Israel; Achal, V., Environmental Engineering Program, Guangdong Technion – Israel Institute of Technology, Shantou, 515063, China, Technion – Israel Institute of Technology, Haifa, 32000, Israel","E-waste is discarded and shipped mostly to developing countries located in Asian continent for disposal from other developed countries. Especially 70% of the world's e-waste ends up in Guiyu, a small town located in Guangdong Province of China. As little as 25% is recycled in formal recycling centers with adequate protection for workers and the other e-waste arrived in those areas is not handled in organized manner. As per reports only roughly 12.5% of e-waste is actually recycled, and the recycling efforts in those regions are primitive and result in toxic substances being leached into the surrounding ecosystems. In addition to persistent organic pollutants, there are many heavy metals found in the ground and river sediments in Guiyu, exceeding the threshold set to protect human health. Those areas are no longer suitable for growing food, and water is unsafe for drinking, due to the amount of toxins leached into the groundwater and land. Hazardous threats to environment and human health due to hazardous substances of e-waste all around China, as well as the current e-waste management were documented in this review. The article concludes with controlled contamination sources, and eco-friendly and efficient remediation technologies to solve e-waste problem in China. © 2020 Elsevier B.V.","China; E-waste; Environmental contaminants; Government management; Human health","Developing countries; Groundwater; Groundwater pollution; Hazards; Health; Health risks; Heavy metals; Leaching; Organic pollutants; Potable water; Recycling; Remediation; River pollution; Waste disposal; Wastes; Contamination sources; Developed countries; Guangdong Province; Hazardous substances; Persistent organic pollutant (POP); Remediation technologies; River sediments; Toxic substances; Electronic Waste; aluminum; antimony; arsenic; barium; beryllium; bismuth; cadmium; chromium; cobalt; copper; dioxin; flame retardant; gallium; germanium; ground water; heavy metal; indium; lead; lithium; mercury; molybdenum; nickel; polybrominated biphenyl; polybrominated diphenyl ether; polychlorinated biphenyl; polychlorinated dibenzodioxin; polychlorinated dibenzofuran; polycyclic aromatic hydrocarbon; unindexed drug; zinc; heavy metal; electronic waste; environmental impact; hazardous waste; health impact; persistent organic pollutant; recycling; sediment pollution; waste disposal; anemia; Article; bioremediation; bone disease; carcinogenicity; child health; China; developmental disorder; e-waste; environmental exposure; environmental impact; eye irritation; food contamination; hazardous waste; health hazard; heart injury; human; kidney injury; leaching; liver injury; lung injury; mutagenicity; nephrotoxicity; neurotoxicity; persistent organic pollutant; pollution transport; priority journal; recycling; sediment; skin irritation; soil pollution; teratogenicity; thyroid disease; waste disposal; waste management; water pollution; ecosystem; China; Guangdong; Guiyu; China; Ecosystem; Electronic Waste; Humans; Metals, Heavy; Recycling; Refuse Disposal","Article","Final",NA,"Scopus","2-s2.0-85085841848","selected","Health of contamination?","excluded",NA
"ref_091","Afgun Usmani R.S. and Targio Hashem I.A. and Pillai T.R. and Saeed A. and Abdullahi A.M.","57219849077;57203801178;55257780300;57218123265;57205230531;","Geographic Information System and Big Spatial Data: A Review and Challenges",2020,"International Journal of Enterprise Information Systems","16","4",NA,101,145,NA,NA,"10.4018/IJEIS.2020100106","https://www.scopus.com/inward/record.uri?eid=2-s2.0-85095788366&doi=10.4018%2fIJEIS.2020100106&partnerID=40&md5=5d74385ee6ae29cbbd10b0dd0b7ec33a","Taylor’s University, Malaysia; Center for Advanced Studies in Engineering, Pakistan","Afgun Usmani, R.S., Taylor’s University, Malaysia; Targio Hashem, I.A., Taylor’s University, Malaysia; Pillai, T.R., Taylor’s University, Malaysia; Saeed, A., Center for Advanced Studies in Engineering, Pakistan; Abdullahi, A.M., Taylor’s University, Malaysia","Geographic information system (GIS) is designed to generate maps, manage spatial datasets, perform sophisticated “what if” spatial analyses, visualize multiple spatial datasets simultaneously, and solve location-based queries. The impact of big data is in every industry, including the GIS. The location-based big data also known as big spatial data has significant implications as it forces the industry to contemplate how to acquire and leverage spatial information. In this study, a comprehensive taxonomy is created to provide a better understanding of the uses of GIS and big spatial data. The taxonomy is made up of big data technologies, GIS data sources, tools, analytics, and applications. The authors look into the importance of big spatial data and its implications, review the data sources, and GIS analytics, applications, and GIS tools. Furthermore, in order to guide researchers interested in GIS, the challenges that require substantial research efforts are taken into account. Lastly, open issues in GIS that require further observation are summarized. Copyright © 2020, IGI Global.","Analytics; Big Data; Big Spatial Data; Geographic Information Systems; GIS; GIS Tools; Prediction","Big data; Geographic information systems; Information systems; Information use; Taxonomies; Data technologies; Data-sources; Location based; Research efforts; Spatial analysis; Spatial data; Spatial datasets; Spatial informations; Information management","Article","Final",NA,"Scopus","2-s2.0-85095788366","selected","Data visualization of geography information","excluded","Geographic informtion / tools"
"ref_095","Niesten E. and Jolink A.","24448703000;6508258736;","Motivations for Environmental Alliances: Generating and Internalizing Environmental and Knowledge Value",2020,"International Journal of Management Reviews","22","4",NA,356,377,NA,NA,"10.1111/ijmr.12228","https://www.scopus.com/inward/record.uri?eid=2-s2.0-85085578651&doi=10.1111%2fijmr.12228&partnerID=40&md5=dde778c861386a14c21a3eae63e58b9f","Alliance Manchester Business School, University of Manchester, Booth Street West, Manchester, M15 6PB, United Kingdom; SKEMA Business School – Université Côte d'Azur, Pôle Universitaire Léonard de Vinci, Espl. Mona Lisa, Courbevoie, 92400, France","Niesten, E., Alliance Manchester Business School, University of Manchester, Booth Street West, Manchester, M15 6PB, United Kingdom; Jolink, A., SKEMA Business School – Université Côte d'Azur, Pôle Universitaire Léonard de Vinci, Espl. Mona Lisa, Courbevoie, 92400, France","Environmental alliances are a common response to societal sustainability demands. In environmental alliances, firms collaboratively exploit and explore environmental technologies to address market opportunities while simultaneously generating positive environmental impacts. A striking idiosyncrasy is that in addition to economic value, environmental alliances generate two types of external value: environmental value from positive effects on air, water, land and biodiversity, and knowledge value from innovations in environmental technologies. Research on motivations for environmental alliances is dispersed and underdeveloped compared to the well-established literature on motivations for strategic alliances that emphasize economic value. This study therefore develops a classification of motivations for environmental alliances by combining the literature on strategic alliances and that on environmental and knowledge value. The resulting classification includes motivations for environmental alliances to generate environmental and knowledge value as well as motivations to create economic value by internalizing environmental and knowledge value. A systematic review of 123 articles on environmental inter-firm alliances identifies specific motivations to populate the new classification. We show that alliance partners are motivated to share sustainable resources, reduce sustainability risk, respond to stakeholders or invest in specific sustainable assets to generate external value. They collaborate to reduce costs or enhance competitive advantage, reputation or legitimacy to internalize external value. The resource-based view, resource-dependence view, institutional theory and transaction cost economics have not previously distinguished between motivations to generate and internalize external value. We extend their area of application from strategic alliances to environmental alliances, and thus beyond the exclusive pursuit of economic value. © 2020 The Authors. International Journal of Management Reviews published by British Academy of Management and John Wiley & Sons Ltd",NA,NA,"Article","Final",NA,"Scopus","2-s2.0-85085578651","selected","alliances in sust","excluded","Sustainable behaviour"
"ref_098","Chen P. and Yang J. and Jiang Z. and Zhu E. and Mo C.","57216909536;35188402100;57189846411;57190731992;57215083166;","Prediction of future carbon footprint and ecosystem service value of carbon sequestration response to nitrogen fertilizer rates in rice production",2020,"Science of the Total Environment","735",NA,"139506",NA,NA,NA,2,"10.1016/j.scitotenv.2020.139506","https://www.scopus.com/inward/record.uri?eid=2-s2.0-85085260614&doi=10.1016%2fj.scitotenv.2020.139506&partnerID=40&md5=c28b2a2f20f71a7e76a6c6f5c11b446c","College of Environmental and Resource Sciences, Zhejiang University, Zhejiang, Hangzhou  310058, China","Chen, P., College of Environmental and Resource Sciences, Zhejiang University, Zhejiang, Hangzhou  310058, China; Yang, J., College of Environmental and Resource Sciences, Zhejiang University, Zhejiang, Hangzhou  310058, China; Jiang, Z., College of Environmental and Resource Sciences, Zhejiang University, Zhejiang, Hangzhou  310058, China; Zhu, E., College of Environmental and Resource Sciences, Zhejiang University, Zhejiang, Hangzhou  310058, China; Mo, C., College of Environmental and Resource Sciences, Zhejiang University, Zhejiang, Hangzhou  310058, China","There is concern for variations of the carbon footprint (CF) and ecosystem service value of carbon sequestration (ESVCS) related to nitrogen (N) fertilizer rate in rice production under future climate change. To explore possible future ecological effects of N fertilizer rate, a DeNitrification–DeComposition (DNDC) model combined with Representative Concentration Pathway (RCP) projections (RCP 4.5 and RCP 8.5) were used to predict the CF and ESVCS of rice production. The model was validated by a two-year field experiment, and then seven N fertilizer levels (0, 75, 150, 190, 225, 300, and 375 kg N/ha) were set for prediction from 2015 to 2050. The validation results indicated a good fit between the DNDC-simulated and observed data of GHG emission and rice yield. Under RCP 8.5, the mean CF was 4.5–8.7% higher and the average ESVCS was 3.6–7.4% lower than those under RCP 4.5. The effects of N fertilizer rate on CF and ESVCS were consistent between the two climate change scenarios. In both RCPs, it was found that CF and ESVCS were mainly influenced by N fertilizer rate due to the latter's effect on CH4 emissions and crop carbon fixation. CH4 was the main contributor to CF during 2015–2050, accounting for 43.9–58.3% of the total CF. Agricultural inputs were also large contributors to CF, and N fertilizer increased the indirect GHG emissions by 24.6–122.2% compared with no N fertilization treatment. Among the studied N fertilizer rates, 190 kg N/ha was the optimal rate, obtaining the lowest CF and highest ESVCS. These results indicate that, under future climate change, an N fertilizer rate of 190 kg N/ha could achieve a trade-off between high yield, reduction of CF, and improvement of ESVCS in rice production. © 2020 Elsevier B.V.","Climate change; DNDC model; GHG emissions; N fertilizer; Rice ecosystem","Agricultural robots; Carbon footprint; Climate change; Economic and social effects; Ecosystems; Emission control; Forecasting; Greenhouse gases; Carbon sequestration; Climate change scenarios; Ecological effect; Ecosystem service values; Fertilizer rates; Field experiment; Nitrogen fertilizer rate; Validation results; Nitrogen fertilizers; methane; nitrogen fertilizer; carbon footprint; carbon sequestration; concentration (composition); crop production; crop yield; denitrification; ecosystem service; environmental economics; fertilizer application; future prospect; nitrogen; prediction; rice; trade-off; Article; calibration; carbon footprint; carbon sequestration; climate change; crop production; ecosystem; harvest; prediction; priority journal; rice; simulation; soil acidity; soil texture; validation process","Article","Final",NA,"Scopus","2-s2.0-85085260614","selected","ecosystem service example","selected","Ecosystem services"
"ref_099","Nika C.E. and Gusmaroli L. and Ghafourian M. and Atanasova N. and Buttiglieri G. and Katsou E.","57188851896;57196466145;57218118777;12763953800;15031298100;26040737500;","Nature-based solutions as enablers of circularity in water systems: A review on assessment methodologies, tools and indicators",2020,"Water Research","183",NA,"115988",NA,NA,NA,2,"10.1016/j.watres.2020.115988","https://www.scopus.com/inward/record.uri?eid=2-s2.0-85087947887&doi=10.1016%2fj.watres.2020.115988&partnerID=40&md5=0d002f5ff71009ce4d05f49f30626db5","Department of Civil & Environmental Engineering, Institute of Environment, Health and Societies, Brunel University London, Uxbridge Campus, Uxbridge, Middlesex  UB8 3PH, United Kingdom; Catalan Institute for Water Research (ICRA), Emili Grahit 101, Girona, 17003, Spain; Universitat de GironaGirona, Spain; Faculty of Civic and Geodetic Engineering, University of Ljubljana, Hajdrihova 28, Ljubljana, Slovenia","Nika, C.E., Department of Civil & Environmental Engineering, Institute of Environment, Health and Societies, Brunel University London, Uxbridge Campus, Uxbridge, Middlesex  UB8 3PH, United Kingdom; Gusmaroli, L., Catalan Institute for Water Research (ICRA), Emili Grahit 101, Girona, 17003, Spain, Universitat de GironaGirona, Spain; Ghafourian, M., Department of Civil & Environmental Engineering, Institute of Environment, Health and Societies, Brunel University London, Uxbridge Campus, Uxbridge, Middlesex  UB8 3PH, United Kingdom; Atanasova, N., Faculty of Civic and Geodetic Engineering, University of Ljubljana, Hajdrihova 28, Ljubljana, Slovenia; Buttiglieri, G., Catalan Institute for Water Research (ICRA), Emili Grahit 101, Girona, 17003, Spain, Universitat de GironaGirona, Spain; Katsou, E., Department of Civil & Environmental Engineering, Institute of Environment, Health and Societies, Brunel University London, Uxbridge Campus, Uxbridge, Middlesex  UB8 3PH, United Kingdom","Water has been pushed into a linear model, which is increasingly acknowledged of causing cumulative emissions of pollutants, waste stocks, and impacting on the irreversible deterioration of water and other resources. Moving towards a circular model in the water sector, the configuration of future water infrastructure changes through the integration of grey and green infrastructure, forming Nature-based Solutions (NBS) as an integral component that connects human-managed to nature-managed water systems. In this study, a thorough appraisal of the latest literature is conducted, providing an overview of the existing tools, methodologies and indicators that have been used to assess NBS for water management, as well as complete water systems considering the need of assessing both anthropogenic and natural elements. Furthermore, facilitators and barriers with respect to existing policies and regulations on NBS and circularity have been identified. The study concludes that the co-benefits of NBS for water management are not adequately assessed. A holistic methodology assessing complete water systems from a circularity perspective is still needed integrating existing tools (i.e. hydro-biogeochemical models), methods (i.e. MFA-based and LCA) and incorporating existing and/or newly-developed indicators. © 2020 The Authors","Assessment methods; Circular economy; Key performance indicators; Nature-based solutions; Water systems","water; human; Humans; Water","Review","Final",NA,"Scopus","2-s2.0-85087947887","selected","nature based solutions
aceptado por curiosidad","excluded","Circular economy"
